{
  "slug": "belgium-endive",
  "common_name": "Belgium Endive",
  "botanical_name": "Cichorium intybus",
  "description": "Belgian Endive (not to be confused with Endive) is a chicory cultivar that is grown for its small head of tender, cream-colored, slightly bitter leaves. The plant is first grown outside, then the tops are cut and the thick roots are transplanted indoors where they are grown without any sunlight in a process known as \"forcing.\" The lack of sunlight prevents the new leaf growth from turning green or opening up. The paler the leaves, the less bitter the taste. Belgian Endive can be roasted, tossed in salads, or baked into various dishes. The harder inner part of the stem at the bottom of the head can be removed before cooking to reduce bitterness.",
  "sowing_method": "Direct seed, thin to 15cm apart",
  "row_spacing_cm": 15,
  "sun_level": "half_sun",
  "family": "Asteraceae",
  "genus": "Cichorium",
  "soil_ph_min": 6.0,
  "soil_ph_max": 7.5,
  "is_edible": true,
  "edible_parts": [
    "flowers",
    "leaves"
  ],
  "companions": [
    {
      "companion_slug": "tatsoi",
      "relationship": "good",
      "notes": "openfarm-crops-rescue lists this as a companion without indicating polarity; assumed 'good' per common convention"
    }
  ],
  "data_sources": [
    {
      "source_url": "https://github.com/thefullnacho/openfarm-crops-rescue",
      "attribution": "openfarm-crops-rescue"
    },
    {
      "source_url": "https://trefle.io",
      "attribution": "trefle"
    },
    {
      "attribution": "ollama-growth-habit-inference",
      "notes": "growth_habit='rosette' inferred by Ollama (Trefle growth_habit is bare 'Forb/herb' - ambiguous between upright/rosette/spreading, deferred to Ollama); reasoning: Belgian Endive forms a head of leaves that radiate from a central point, similar to other rosette-forming leafy greens."
    }
  ],
  "growth_habit": "rosette"
}
