{
  "slug": "butternut-squash",
  "common_name": "Butternut Squash",
  "botanical_name": "Cucurbita moschata",
  "description": "Butternut squash is a winter squash cultivar that produces long squash with smooth, tan-yellow skin and a rounded compartment of seeds at the bottom. Flesh is deep orange and firm with a sweet, nutty taste. Butternut squash becomes deeper orange and sweeter and richer as it ripens. Like other squash, it grows on sprawling vines. If starting seeds indoors, use peat pots and directly transplant them into the soil to reduce root disturbance. Harvest squash before any hard frosts and cure. Winter squash can be stored for up to 3 months in a cool, dry, well-ventilated place.",
  "sowing_method": "Direct seed. If planting indoors, harden off before transplanting seedlings outside.",
  "spread_cm": 150,
  "row_spacing_cm": 90,
  "height_cm": 30,
  "sun_level": "full_sun",
  "family": "Cucurbitaceae",
  "genus": "Cucurbita",
  "is_edible": false,
  "companions": [
    {
      "companion_slug": "borage",
      "relationship": "good",
      "notes": "openfarm-crops-rescue lists this as a companion without indicating polarity; assumed 'good' per common convention"
    },
    {
      "companion_slug": "carrot",
      "relationship": "good",
      "notes": "openfarm-crops-rescue lists this as a companion without indicating polarity; assumed 'good' per common convention"
    }
  ],
  "data_sources": [
    {
      "source_url": "https://github.com/thefullnacho/openfarm-crops-rescue",
      "attribution": "openfarm-crops-rescue"
    },
    {
      "source_url": "https://trefle.io",
      "attribution": "trefle"
    },
    {
      "source_url": "https://trefle.io",
      "attribution": "trefle-growth-habit",
      "notes": "growth_habit='spreading' - Trefle growth_habit='Forb/herb, Vine' includes 'Vine', but butternut-squash is a known ground-sprawling vine (curated override), not a trellised climber"
    },
    {
      "attribution": "ollama-life-cycle-inference",
      "notes": "life_cycle='annual' inferred by Ollama; reasoning: Butternut squash is typically grown as an annual in temperate climates like Belgium, as it is sensitive to frost and does not survive cold winters."
    }
  ],
  "growth_habit": "spreading",
  "life_cycle": "annual"
}
