{
  "slug": "banana-pepper",
  "common_name": "Banana Pepper",
  "botanical_name": "Capsicum annuum",
  "description": "Banana peppers are Capsicum annuum cultivars that are curved like a banana and have a mild, tangy taste. They are often bright yellow, but can also be green, red, or orange. Mature, ripe peppers are sweeter than younger ones. Spicy varieties are called Hungarian wax peppers. Banana peppers are often confused with Pepperoncini, which are a separate cultivar of Capiscum annuum and Capsicum frutescens. Banana peppers can be eaten raw, stuffed, or pickled.",
  "sowing_method": "Direct seed indoors, transplant seedlings outside after hardening off.",
  "spread_cm": 30,
  "row_spacing_cm": 45,
  "height_cm": 60,
  "sun_level": "full_sun",
  "family": "Solanaceae",
  "genus": "Capsicum",
  "is_edible": true,
  "data_sources": [
    {
      "source_url": "https://github.com/thefullnacho/openfarm-crops-rescue",
      "attribution": "openfarm-crops-rescue"
    },
    {
      "source_url": "https://trefle.io",
      "attribution": "trefle"
    },
    {
      "source_url": "https://trefle.io",
      "attribution": "trefle-growth-habit",
      "notes": "growth_habit='spreading' - Trefle growth_habit='Subshrub, Forb/herb' includes Shrub/Subshrub"
    }
  ],
  "growth_habit": "spreading"
}
