{
  "slug": "jalapeno-pepper",
  "common_name": "Jalapeño Pepper",
  "botanical_name": "Capsicum annuum",
  "description": "Small hot pepper, about 2.5 x 7.5cm, medium spiciness. Can be harvested green (when the fruit is younger and milder) or left on the plant longer until it turns red and becomes hotter and sweeter.",
  "sowing_method": "Direct seed indoors, harden seedlings off before transplanting outside.",
  "spread_cm": 45,
  "row_spacing_cm": 45,
  "height_cm": 40,
  "sun_level": "full_sun",
  "family": "Solanaceae",
  "genus": "Capsicum",
  "is_edible": true,
  "data_sources": [
    {
      "source_url": "https://github.com/thefullnacho/openfarm-crops-rescue",
      "attribution": "openfarm-crops-rescue"
    },
    {
      "source_url": "https://trefle.io",
      "attribution": "trefle"
    }
  ]
}
