{
  "slug": "sage",
  "common_name": "Sage",
  "botanical_name": "Salvia officinalis",
  "description": "Sage is an evergreen shrub with woody stems, soft green-gray leaves, and blue to purplish flowers. It is in the Mint family (Lamiaceae), and is perennial in Zones 4-8. It can be used fresh or dried, and has culinary and medicinal uses.",
  "sowing_method": "Direct seed indoors, harden seedlings off before transplanting outside.",
  "spread_cm": 50,
  "row_spacing_cm": 30,
  "height_cm": 70,
  "sun_level": "full_sun",
  "family": "Lamiaceae",
  "genus": "Salvia",
  "days_to_maturity": 75,
  "soil_ph_min": 7.5,
  "soil_ph_max": 8.0,
  "is_edible": false,
  "succession_enabled": false,
  "succession_max_sowings": 1,
  "companions": [
    {
      "companion_slug": "bok-choy",
      "relationship": "good",
      "notes": "openfarm-crops-rescue lists this as a companion without indicating polarity; assumed 'good' per common convention"
    },
    {
      "companion_slug": "cabbage",
      "relationship": "good"
    },
    {
      "companion_slug": "carrot",
      "relationship": "good"
    },
    {
      "companion_slug": "rosemary",
      "relationship": "good"
    },
    {
      "companion_slug": "onion",
      "relationship": "bad"
    },
    {
      "companion_slug": "cucumber",
      "relationship": "bad"
    },
    {
      "companion_slug": "basil",
      "relationship": "bad"
    }
  ],
  "pest_interactions": [
    {
      "interaction_type": "attracts",
      "pest_or_insect": "honeybees"
    },
    {
      "interaction_type": "attracts",
      "pest_or_insect": "cabbage butterfly"
    },
    {
      "interaction_type": "repels",
      "pest_or_insect": "cabbage flies"
    },
    {
      "interaction_type": "repels",
      "pest_or_insect": "carrot fly"
    },
    {
      "interaction_type": "repels",
      "pest_or_insect": "black flea beetle"
    },
    {
      "interaction_type": "repels",
      "pest_or_insect": "cabbage looper"
    },
    {
      "interaction_type": "repels",
      "pest_or_insect": "cabbage maggot"
    },
    {
      "interaction_type": "repels",
      "pest_or_insect": "repels many bean parasites"
    }
  ],
  "data_sources": [
    {
      "source_url": "https://github.com/thefullnacho/homesteader-labs-next/tree/master/content/crops",
      "attribution": "homesteader-labs"
    },
    {
      "source_url": "https://github.com/thefullnacho/openfarm-crops-rescue",
      "attribution": "openfarm-crops-rescue"
    },
    {
      "source_url": "https://trefle.io",
      "attribution": "trefle"
    },
    {
      "source_url": "https://plants.sc.egov.usda.gov/DocumentLibrary/Txt/plantlst.txt",
      "attribution": "usda-plants"
    },
    {
      "source_url": "https://en.wikipedia.org/wiki/List_of_companion_plants",
      "attribution": "wikipedia-companion-plants"
    },
    {
      "attribution": "project-gutenberg",
      "source_url": "https://www.gutenberg.org/cache/epub/76930/pg76930-images.html",
      "notes": "growing_information text sourced from 'How and what to grow in a kitchen garden of one acre'"
    },
    {
      "source_url": "https://trefle.io",
      "attribution": "trefle-growth-habit",
      "notes": "growth_habit='spreading' - Trefle growth_habit='Subshrub, Shrub, Forb/herb' includes Shrub/Subshrub"
    },
    {
      "attribution": "ollama-life-cycle-inference",
      "notes": "life_cycle='perennial' inferred by Ollama; reasoning: Sage (Salvia officinalis) is described as an evergreen shrub that can be cut back and will regrow multiple times in a season, indicating it is typically grown as a perennial in a home garden."
    }
  ],
  "growing_information": [
    {
      "text": "A dozen roots or more of this herb should be planted in some part of the garden where it will not be disturbed by the plow, or if this cannot be done readily, the roots can be taken up when the plowing is done, divided and reset, which would probably raise a larger and finer crop of leaves than allowing them to stand in the same place year after year. The crop should be cut off a few inches above the ground, as soon as it has made its growth and before it begins to bloom. The shoots will again start to grow, and two or three crops can be cut in a season; the cut tops can be tied in bunches and hung to the rafters, or spread thinly on the floor of a cool loft or garret.",
      "record_type": "raw",
      "source_url": "https://www.gutenberg.org/cache/epub/76930/pg76930-images.html",
      "attribution": "How and what to grow in a kitchen garden of one acre",
      "copyright_status": "Public domain in the USA."
    }
  ],
  "bedding_needs": [
    {
      "need_type": "plowing",
      "notes": "roots can be taken up when the plowing is done, divided and reset"
    },
    {
      "need_type": "disturbance",
      "notes": "not disturbed by the plow"
    }
  ],
  "growth_habit": "spreading",
  "life_cycle": "perennial",
  "edible_parts": [
    "leaves"
  ],
  "periods": [
    {
      "period_type": "harvesting",
      "start_month": 12,
      "end_month": 12
    }
  ],
  "water_needs_mm_per_week": 12.7
}
