{
  "slug": "horseradish",
  "common_name": "horseradish",
  "botanical_name": "Armoracia rusticana",
  "description": "Horseradish is a hardy perennial plant in the Brassica family (Brassicaceae) grown for it's tapered white taproot, generally 20-25cm long, which is used as a spice and eaten as a vegetable. Roots are ground or shredded to make pungent, spicy sauces and condiments. Seeds or root cuttings are planted in the fall, and the taproot is harvested the following year. It can be harvested in fall after the first frost kills off the greens, or in the early spring before new leaves grow. A winter of hard frosts will sweeten the root. Horseradish should be divided and replanted every 2 years to prevent it from becoming woody. The plant spreads rapidly. If invasive tendencies are managed properly, it is a good companion plant because it wards off diseases and repels insects like potato bugs and beetles, aphids, whiteflies, blister beetles, and some caterpillars.",
  "sowing_method": "Root cuttings",
  "spread_cm": 30,
  "row_spacing_cm": 30,
  "height_cm": 180,
  "sun_level": "full_sun",
  "family": "Brassicaceae",
  "genus": "Armoracia",
  "soil_ph_min": 5.5,
  "soil_ph_max": 6.5,
  "is_edible": true,
  "companions": [
    {
      "companion_slug": "blackberry",
      "relationship": "good",
      "notes": "openfarm-crops-rescue lists this as a companion without indicating polarity; assumed 'good' per common convention"
    }
  ],
  "data_sources": [
    {
      "source_url": "https://github.com/thefullnacho/openfarm-crops-rescue",
      "attribution": "openfarm-crops-rescue"
    },
    {
      "source_url": "https://trefle.io",
      "attribution": "trefle"
    },
    {
      "source_url": "https://plants.sc.egov.usda.gov/DocumentLibrary/Txt/plantlst.txt",
      "attribution": "usda-plants"
    }
  ]
}
