{
  "slug": "cowpea",
  "common_name": "Cowpea",
  "botanical_name": "Vigna unguiculata",
  "description": "Cowpeas are an annual herbaceous legume in the genus Vigna. They have a high tolerance for sandy, infertile, acidic soil and low rainfall, making them an important crop for poor farmers in Africa and other semi-arid regions. Cowpeas need 90-100 frost-free days and their optimum growth temperature is 30°C. They are grown for human consumption, cattle feed, and as a cover crop. There are four subspecies of cowpea, three of which are cultivated. Common cultivars include black-eyed pea, southern pea, yardlong bean, catjang, and crowder pea. Cowpeas can be erect, semi-erect, or climbing. Their seeds are high in protein, and their leaves and immature seed pods can also be consumed. The whole plant is used as forage for animals. They make a great cover crop or intercrop because their root nodules fix atmospheric nitrogen. They can produce as much as 315lb./acre of nitrogen. If growing as a cover crop, till under when the plants are flowering and before they go to seed.",
  "sowing_method": "Direct seed outdoors, thin to 10cm",
  "row_spacing_cm": 5,
  "height_cm": 90,
  "sun_level": "full_sun",
  "family": "Fabaceae",
  "genus": "Vigna",
  "soil_ph_min": 6.0,
  "soil_ph_max": 8.0,
  "is_edible": false,
  "companions": [
    {
      "companion_slug": "banana",
      "relationship": "good",
      "notes": "openfarm-crops-rescue lists this as a companion without indicating polarity; assumed 'good' per common convention"
    },
    {
      "companion_slug": "cassava",
      "relationship": "good",
      "notes": "openfarm-crops-rescue lists this as a companion without indicating polarity; assumed 'good' per common convention"
    },
    {
      "companion_slug": "millet",
      "relationship": "good",
      "notes": "openfarm-crops-rescue lists this as a companion without indicating polarity; assumed 'good' per common convention"
    },
    {
      "companion_slug": "rice-bean",
      "relationship": "good",
      "notes": "openfarm-crops-rescue lists this as a companion without indicating polarity; assumed 'good' per common convention"
    }
  ],
  "data_sources": [
    {
      "source_url": "https://github.com/thefullnacho/openfarm-crops-rescue",
      "attribution": "openfarm-crops-rescue"
    },
    {
      "source_url": "https://trefle.io",
      "attribution": "trefle"
    },
    {
      "source_url": "https://plants.sc.egov.usda.gov/DocumentLibrary/Txt/plantlst.txt",
      "attribution": "usda-plants"
    },
    {
      "source_url": "https://trefle.io",
      "attribution": "trefle-growth-habit",
      "notes": "growth_habit='climbing' - Trefle growth_habit='Vine, Forb/herb' includes 'Vine'"
    }
  ],
  "growth_habit": "climbing"
}
