{
  "slug": "beans-pole",
  "common_name": "Pole Beans",
  "row_spacing_cm": 17.8,
  "sun_level": "full_sun",
  "days_to_maturity": 65,
  "succession_enabled": false,
  "succession_max_sowings": 1,
  "botanical_name": "Phaseolus vulgaris",
  "companions": [
    {
      "companion_slug": "corn",
      "relationship": "good"
    },
    {
      "companion_slug": "cucumber",
      "relationship": "good"
    },
    {
      "companion_slug": "potato",
      "relationship": "good"
    },
    {
      "companion_slug": "carrot",
      "relationship": "good"
    },
    {
      "companion_slug": "onion",
      "relationship": "bad"
    },
    {
      "companion_slug": "garlic",
      "relationship": "bad"
    },
    {
      "companion_slug": "pepper-bell",
      "relationship": "bad"
    },
    {
      "companion_slug": "pepper-hot",
      "relationship": "bad"
    },
    {
      "companion_slug": "beets",
      "relationship": "bad"
    }
  ],
  "pest_interactions": [
    {
      "interaction_type": "vulnerable_to",
      "pest_or_insect": "aphid"
    }
  ],
  "data_sources": [
    {
      "source_url": "https://github.com/thefullnacho/homesteader-labs-next/tree/master/content/crops",
      "attribution": "homesteader-labs"
    },
    {
      "attribution": "ollama-inference",
      "notes": "botanical_name inferred from common_name by Ollama - no source had one; not sourced from an external database, verify before trusting"
    },
    {
      "attribution": "ollama-growth-habit-inference",
      "notes": "growth_habit='climbing' inferred by Ollama (no Trefle growth_habit data (no cached match or null field)); reasoning: Pole beans are known for their vining habit and require a trellis or support to grow upward."
    },
    {
      "source_url": "https://en.wikipedia.org/wiki/Phaseolus",
      "attribution": "wikipedia-taxonomy",
      "notes": "family/genus backfilled from Wikipedia/Wikidata taxonomy for genus 'Phaseolus'"
    },
    {
      "attribution": "ollama-life-cycle-inference",
      "notes": "life_cycle='annual' inferred by Ollama; reasoning: Pole beans are typically grown as annuals in temperate climates like Belgium, as they complete their life cycle within one growing season."
    },
    {
      "attribution": "ollama-edible-parts-inference",
      "notes": "edible_parts=['pods'] inferred by Ollama; reasoning: Pole beans are typically eaten as pods when they are immature and tender."
    }
  ],
  "growth_habit": "climbing",
  "genus": "Phaseolus",
  "family": "Fabaceae",
  "life_cycle": "annual",
  "edible_parts": [
    "pods"
  ],
  "water_needs_mm_per_week": 25.4
}
