{
  "slug": "purslane",
  "common_name": "Purslane",
  "botanical_name": "Portulaca oleracea",
  "description": "Purslane is a fast-growing succulent herb that is native to Asia but has since naturalized throughout the world. The plant has red to purple stems that radiate from a central taproot, fleshy green leaves, and yellow flowers. The stems are somewhat upright, but spread to create a mat of foliage. Leaves and stems have a sweet, acid-like flavor similar to spinach and are high in omega-3 fatty acids, Vitamins A, C, and B, iron, magnesium, calcium, and potassium. Harvest plants before they flower and add to salads, sandwiches, sauté, or make into pesto. Purslane can become VERY invasive because it spreads through stem pieces and a single plant can produce 240,000 seeds that are viable for 5-40 years. Container growing is strongly recommended to limit the spread of stem cuttings. Be sure to harvest plants before they flower and set seed.",
  "sowing_method": "Direct seed cuttings or seeds outdoors on surface of soil after last frost",
  "spread_cm": 60,
  "row_spacing_cm": 5,
  "height_cm": 10,
  "sun_level": "full_sun",
  "family": "Portulacaceae",
  "genus": "Portulaca",
  "soil_ph_min": 7.0,
  "soil_ph_max": 7.5,
  "is_edible": true,
  "data_sources": [
    {
      "source_url": "https://github.com/thefullnacho/openfarm-crops-rescue",
      "attribution": "openfarm-crops-rescue"
    },
    {
      "source_url": "https://trefle.io",
      "attribution": "trefle"
    },
    {
      "source_url": "https://plants.sc.egov.usda.gov/DocumentLibrary/Txt/plantlst.txt",
      "attribution": "usda-plants"
    },
    {
      "attribution": "project-gutenberg",
      "source_url": "https://www.gutenberg.org/cache/epub/77032/pg77032-images.html",
      "notes": "growing_information text sourced from 'The garden yard'"
    },
    {
      "attribution": "ollama-growth-habit-inference",
      "notes": "growth_habit='spreading' inferred by Ollama (Trefle growth_habit is bare 'Forb/herb' - ambiguous between upright/rosette/spreading, deferred to Ollama); reasoning: Purslane spreads outward from its base to create a mat of foliage."
    },
    {
      "attribution": "ollama-life-cycle-inference",
      "notes": "life_cycle='annual' inferred by Ollama; reasoning: Purslane is typically grown as an annual in temperate climates like Belgium because it matures quickly and is sown early in the spring."
    }
  ],
  "growing_information": [
    {
      "text": "Purslane, or, as it is more generally called,\r\n“pusley,” is another herb that the French\r\ngrowers have greatly improved. The common\r\npusley weed is a weak, trailing plant, but the\r\nFrench, cultivated variety stands up stiff with\r\nlarge leaves and juicy stems. It grows easily\r\nin any good garden soil, matures quickly and\r\nis not hurt by warm weather. The seeds are\r\nsown early in the spring and there is little\r\ndanger of the cultivated sort sowing itself and\r\nbecoming a pest.\n\nThere are some other varieties of greens;\r\nbut this book aims only to treat of those which\r\nare generally grown and for which there is a\r\nsure market each year.\n\n[141]",
      "record_type": "raw",
      "source_url": "https://www.gutenberg.org/cache/epub/77032/pg77032-images.html",
      "attribution": "The garden yard",
      "copyright_status": "Public domain in the USA."
    }
  ],
  "bedding_needs": [
    {
      "need_type": "ground-cover",
      "notes": "grows easily in any good garden soil"
    }
  ],
  "growth_habit": "spreading",
  "life_cycle": "annual"
}
