{
  "slug": "banana",
  "common_name": "Banana",
  "botanical_name": "Musa spp.",
  "description": "The banana is a tropical perennial herb that produces edible fruits. There are many different species of banana within the Musa genus. Banana trees can be grown outdoors in tropic and subtropical climates, and indoors in northern areas. Bananas like company: plant them in blocks or clumps so they can shelter one another from wind and build humidity. The best bananas will grow towards the middle of the clump. Hot, dry air and temperatures below 0ºC will seriously harm or kill a banana tree.",
  "sowing_method": "Rhizome or sucker",
  "height_cm": 4000,
  "sun_level": "full_sun",
  "family": "Musaceae",
  "genus": "Musa",
  "companions": [
    {
      "companion_slug": "cowpea",
      "relationship": "good",
      "notes": "openfarm-crops-rescue lists this as a companion without indicating polarity; assumed 'good' per common convention"
    },
    {
      "companion_slug": "durian",
      "relationship": "good",
      "notes": "openfarm-crops-rescue lists this as a companion without indicating polarity; assumed 'good' per common convention"
    },
    {
      "companion_slug": "yam",
      "relationship": "good",
      "notes": "openfarm-crops-rescue lists this as a companion without indicating polarity; assumed 'good' per common convention"
    }
  ],
  "data_sources": [
    {
      "source_url": "https://github.com/thefullnacho/openfarm-crops-rescue",
      "attribution": "openfarm-crops-rescue"
    },
    {
      "source_url": "https://plants.sc.egov.usda.gov/DocumentLibrary/Txt/plantlst.txt",
      "attribution": "usda-plants"
    },
    {
      "attribution": "ollama-growth-habit-inference",
      "notes": "growth_habit='tree' inferred by Ollama (no Trefle growth_habit data (no cached match or null field)); reasoning: Banana plants have a single trunk and grow to significant heights."
    },
    {
      "attribution": "ollama-life-cycle-inference",
      "notes": "life_cycle='annual' inferred by Ollama; reasoning: Bananas are not typically grown outdoors in Belgium due to the temperate climate and cold temperatures."
    },
    {
      "attribution": "ollama-edible-parts-inference",
      "notes": "edible_parts=['fruit'] inferred by Ollama; reasoning: The primary edible part of a banana plant is the fruit."
    },
    {
      "attribution": "manual-research",
      "notes": "is_edible corrected from false to true (GitHub issue #165): edible_parts=['fruit'] was already populated, a direct contradiction with is_edible=false, and no is_toxic flag or toxicity_notes explained the discrepancy - a full-dataset audit found this affecting 120 plants (grown from an earlier 25-plant spot-check once backlog #133's edible_parts backfill widened coverage), all of them unambiguous real food/herb/fruit crops."
    }
  ],
  "growth_habit": "tree",
  "life_cycle": "annual",
  "edible_parts": [
    "fruit"
  ],
  "is_edible": true
}
