{
  "slug": "amberique-bean",
  "common_name": "amberique-bean",
  "botanical_name": "Strophostyles helvola",
  "family": "Fabaceae",
  "genus": "Strophostyles",
  "is_edible": false,
  "companions": [
    {
      "companion_slug": "snow-pea",
      "relationship": "good",
      "notes": "openfarm-crops-rescue lists this as a companion without indicating polarity; assumed 'good' per common convention"
    }
  ],
  "data_sources": [
    {
      "source_url": "https://github.com/thefullnacho/openfarm-crops-rescue",
      "attribution": "openfarm-crops-rescue"
    },
    {
      "source_url": "https://trefle.io",
      "attribution": "trefle"
    },
    {
      "source_url": "https://plants.sc.egov.usda.gov/DocumentLibrary/Txt/plantlst.txt",
      "attribution": "usda-plants"
    },
    {
      "attribution": "ollama-growth-habit-inference",
      "notes": "growth_habit='spreading' inferred by Ollama (no Trefle growth_habit data (no cached match or null field)); reasoning: Amberique-bean (Strophostyles helvola) is known for its trailing and sprawling growth habit."
    }
  ],
  "growth_habit": "spreading"
}
