{
  "slug": "shiitake-mushroom",
  "common_name": "shiitake mushroom",
  "botanical_name": "Lentinula edodes",
  "description": "Shiitake mushrooms have white stems with tightly-packed gills that are not directly attached to the stem. Their caps are brown to black. Shiitake have a long history of medicinal use, are high in Vitamins B and D, and are believed to have anti-tumor properties. Growing the mushrooms on logs outdoors (rather than the sawdust used for commercially grown mushrooms) increases their nutrient content. Spawn comes in three different forms, plugs are the easiest to use for beginners.",
  "sowing_method": "Inoculate logs with spawn",
  "sun_level": "half_sun",
  "data_sources": [
    {
      "source_url": "https://github.com/thefullnacho/openfarm-crops-rescue",
      "attribution": "openfarm-crops-rescue"
    },
    {
      "source_url": "https://en.wikipedia.org/wiki/Lentinula",
      "attribution": "wikipedia-taxonomy",
      "notes": "family/genus backfilled from Wikipedia/Wikidata taxonomy for genus 'Lentinula'"
    }
  ],
  "genus": "Lentinula",
  "family": "Omphalotaceae"
}
